{
  "$schema": "https://json-schema.org/draft/2020-12/schema",
  "$id": "https://youaskm3.com/contracts/decision-log-package.metadata.schema.json",
  "title": "youaskm3 decision-log package metadata",
  "type": "object",
  "additionalProperties": false,
  "required": [
    "schema_version",
    "package_id",
    "persona_id",
    "mode",
    "created_by",
    "created_at",
    "source_gap_id",
    "required_files"
  ],
  "properties": {
    "schema_version": {
      "const": "1.0.0"
    },
    "package_id": {
      "type": "string",
      "pattern": "^decision-log-[0-9]{8}-[a-z0-9]+(?:-[a-z0-9]+)*$"
    },
    "persona_id": {
      "type": "string",
      "minLength": 1
    },
    "mode": {
      "enum": [
        "knowledge_addition",
        "gap_resolution",
        "direct_fact_resolution",
        "conflict_resolution"
      ]
    },
    "created_by": {
      "const": "youaskm3.reasoning-assistant"
    },
    "created_at": {
      "type": "string",
      "pattern": "^[0-9]{4}-[0-9]{2}-[0-9]{2}T[0-9]{2}:[0-9]{2}:[0-9]{2}Z$"
    },
    "source_gap_id": {
      "type": [
        "string",
        "null"
      ]
    },
    "required_files": {
      "type": "array",
      "items": {
        "enum": [
          "decision-log.md",
          "knowledge-note.md",
          "metadata.json"
        ]
      },
      "minItems": 3,
      "maxItems": 3,
      "uniqueItems": true
    }
  }
}
