{
  "schema_version": "1.0.0",
  "package_id": "decision-log-20260629-direct-fact",
  "persona_id": "default",
  "mode": "direct_fact_resolution",
  "created_by": "youaskm3.reasoning-assistant",
  "created_at": "2026-06-29T12:10:00Z",
  "source_gap_id": null,
  "required_files": [
    "decision-log.md",
    "knowledge-note.md",
    "metadata.json"
  ]
}
