{
  "schema_version": "1.0.0",
  "package_id": "decision-log-20260629-gap-resolution",
  "persona_id": "default",
  "mode": "gap_resolution",
  "created_by": "youaskm3.reasoning-assistant",
  "created_at": "2026-06-29T12:05:00Z",
  "source_gap_id": "gap-runtime-policy",
  "required_files": [
    "decision-log.md",
    "knowledge-note.md",
    "metadata.json"
  ]
}
